{"$schema":"https://json-schema.org/draft/2020-12/schema","type":"object","properties":{"title":{"type":"string","minLength":1,"maxLength":120},"introduction":{"type":"string","minLength":1,"maxLength":1200},"challenges":{"type":"array","items":{"type":"object","properties":{"title":{"type":"string","minLength":1,"maxLength":160},"scene":{"type":"string","minLength":1,"maxLength":4000},"choices":{"type":"array","items":{"type":"object","properties":{"label":{"type":"string","minLength":1,"maxLength":180},"feedback":{"type":"string","minLength":1,"maxLength":1500},"points":{"type":"integer","minimum":0,"maximum":2}},"required":["label","feedback","points"],"additionalProperties":false},"minItems":2,"maxItems":4}},"required":["title","scene","choices"],"additionalProperties":false},"minItems":3,"maxItems":12},"endings":{"type":"object","properties":{"thoughtful":{"type":"string","minLength":1,"maxLength":2000},"bold":{"type":"string","minLength":1,"maxLength":2000},"exploratory":{"type":"string","minLength":1,"maxLength":2000}},"required":["thoughtful","bold","exploratory"],"additionalProperties":false}},"required":["title","introduction","challenges","endings"],"additionalProperties":false}