{"title":"钟楼之后的岔路","introduction":"三次小小的选择，试着理解角色如何守护这座城。","challenges":[{"title":"微弱的求救","scene":"钟声停止了，你听见废墟后传来声音。","choices":[{"label":"先观察并呼叫同伴","feedback":"同伴确定了安全路线，你们一起找到了被困的信使。","points":2},{"label":"循着声音冲过去","feedback":"你及时回应了求救，但绕过坍塌的墙又花了一些时间。","points":1}]},{"title":"信使的包裹","scene":"信使拜托你把一封信交给车站的守夜人。","choices":[{"label":"确认收件信息再出发","feedback":"原来守夜人今晚换了岗，你找到了正确的站台。","points":2},{"label":"先去车站问问","feedback":"你在问路途中听到了另一位旅人的故事。","points":0}]},{"title":"最后一盏灯","scene":"信已送到，守夜人邀请你留下一句话。","choices":[{"label":"写下今天帮助过你的人","feedback":"大家的名字留下了，一次冒险成为共同的回忆。","points":2},{"label":"画一颗新的星星","feedback":"星星亮在纸上，为陌生人带来一个微小的惊喜。","points":1}]}],"endings":{"thoughtful":"你留心每个细节，让一路遇见的人彼此连接。城市记住了这份温柔。","bold":"你用行动回应求助，偶尔绕路，却也带回了意外的故事。","exploratory":"你走出了一条自己的路。那些偶遇会成为下次出发时的线索。"}}